gig_id,seller,seller_level,score,score_num,title,currency,price_start,keyword,results_count,last_modified_date
124701948,techbetold,NA,4.7,3,I will build a wordpress website using hostgator or bluehost,€,46.58,Website Building,5911,2019-03-29T16:34:22Z
118385382,matt_donnelly,NA,NA,NA,I will collaborate with you to build your website,€,927,Website Building,5911,2019-03-29T16:34:22Z
124888568,single250,NA,NA,NA,I will build you a complete wordpress website,€,88.51,Website Building,5911,2019-03-29T16:34:22Z
104592608,perrydanne,NA,5,82,I will build 10 high quality backlinks for your website,€,46.58,Website Building,5911,2019-03-29T16:34:22Z
31408800,beaverbuilder,Level 2 Seller,5,71,I will create wordpress website with beaver builder,€,46.58,Website Building,5911,2019-03-29T16:34:22Z
118551708,davidrendle,NA,NA,NA,I will design and build your squarespace website,€,624,Website Building,5911,2019-03-29T16:34:22Z
71417441,mostafamoe,Level 1 Seller,5,40,I will build wordpress website pro for you,€,18.63,Website Building,5911,2019-03-29T16:34:22Z
3846393,peterfrog,Level 2 Seller,5,394,I will build responsive wordpress website design,€,4.66,Website Building,5911,2019-03-29T16:34:22Z
99848561,creativedezignz,Level 2 Seller,5,25,I will build a clean and fully responsive wordpress website,€,373,Website Building,5911,2019-03-29T16:34:22Z
96681786,aakash8787,Level 2 Seller,4.9,119,I will create your wordpress website with beaver builder,€,69.87,Website Building,5911,2019-03-29T16:34:22Z
108847387,w3bdesignuk,NA,5,3,"I will design and build a beautiful, bespoke website",€,745,Website Building,5911,2019-03-29T16:34:22Z
109739453,orionwp_com,Level 2 Seller,5,75,I will design your website using elementor pro page builder on wordpress,€,93.16,Website Building,5911,2019-03-29T16:34:22Z
109423247,create_websites,Level 2 Seller,5,107,"I will create wordpress website design,build website in 24h",€,140,Website Building,5911,2019-03-29T16:34:22Z
121579231,shopifyxperts,Level 1 Seller,5,15,"I will build wordpress website, wordpress design, wordpress customization",€,182,Website Building,5911,2019-03-29T16:34:22Z
107151429,rajiur089,NA,4.9,101,I will build your squarespace or shopify store website,€,37.27,Website Building,5911,2019-03-29T16:34:22Z
2306267,arslannawaz,Level 2 Seller,5,721,I will build 50 top local citation manually in USA website to boost your local seo rank,€,9.32,Website Building,5911,2019-03-29T16:34:22Z
119493468,rozyislam,Level 2 Seller,5,42,I will design elegant wordpress website by divi theme and divi builder,€,27.95,Website Building,5911,2019-03-29T16:34:22Z
115837498,sophia_1st,NA,4.9,27,I will build responsive wordpress website design and blog,€,74.53,Website Building,5911,2019-03-29T16:34:22Z
101779144,sofia_rose,Level 2 Seller,5,103,I will build wordpress woocommerce website by woocommerce store,€,93.16,Website Building,5911,2019-03-29T16:34:22Z
60722319,ideasnerd,Level 2 Seller,4.9,200,I will build responsive wordpress website design and blog,€,4.66,Website Building,5911,2019-03-29T16:34:22Z
46853559,safdarrizvi63,Level 1 Seller,5,23,I will build dental wordpress website,€,116,Website Building,5911,2019-03-29T16:34:22Z
32665445,zubair_khan,Level 2 Seller,4.9,164,"I will create website, build wordpress website, custom web design",€,9.32,Website Building,5911,2019-03-29T16:34:22Z
115901475,amazeman,NA,5,17,I will build amazon affiliate website with 8000 products,€,37.27,Website Building,5911,2019-03-29T16:34:22Z
92016001,mankhan,Level 2 Seller,5,11,I will design divi theme builder responsive website,€,27.95,Website Building,5911,2019-03-29T16:34:22Z
122441709,webdesigns_pro,NA,5,7,I will design web pages and build complete website,€,41.92,Website Building,5911,2019-03-29T16:34:22Z
56169294,imtiazz,Level 2 Seller,5,219,"I will create a fully responsive wordpress, build website",€,55.9,Website Building,5911,2019-03-29T16:34:22Z
88047371,shahrukh94,Level 2 Seller,5,196,I will build a professional divi website using divi pagebuilder,€,4.66,Website Building,5911,2019-03-29T16:34:22Z
106039009,twistedweb123,Top Rated Seller,4.9,67,I will search engine optimize your website,€,275,seo,8552,2019-03-29T16:34:32Z
111586435,flori119,Level 2 Seller,5,502,I will top rank your site on first page with supreme seo v1,€,522,seo,8552,2019-03-29T16:34:32Z
72988366,ozzieuk,Top Rated Seller,4.9,1000,I will create a full SEO campaign for your website,€,46.58,seo,8552,2019-03-29T16:34:32Z
107555090,essdex,Level 2 Seller,5,79,I will perform comprehensive SEO service for your website,€,37.27,seo,8552,2019-03-29T16:34:32Z
116786592,fluidicweb,Level 2 Seller,5,72,"I will build dofollow 301 redirect backlink on da 92 plus sites, highest authority SEO",€,23.29,seo,8552,2019-03-29T16:34:32Z
123705406,ofridavid,NA,5,1,"I will publish a guest post on my 73da finance blog , SEO backlink",€,233,seo,8552,2019-03-29T16:34:32Z
107930553,blboss,Level 2 Seller,5,1000,I will boost your google SEO with manual high authority backlinks and trust links,€,4.66,seo,8552,2019-03-29T16:34:32Z
109809085,organicranking,Level 2 Seller,5,51,I will do 5000 plus tiered contextual seo backlinks,€,41.92,seo,8552,2019-03-29T16:34:32Z
104760669,elavin,Level 1 Seller,4.9,85,I will create 5000 dofollow pbn SEO backlinks for google ranking,€,46.58,seo,8552,2019-03-29T16:34:32Z
480545,best_seo,Level 2 Seller,5,1000,I will be your monthly local SEO agency for google maps,€,182,seo,8552,2019-03-29T16:34:32Z
109753684,lisa_rank,Level 2 Seller,5,380,I will do pro1 SEO package and explode your ranking,€,69.87,seo,8552,2019-03-29T16:34:32Z
45973829,markmasonbeast,Level 2 Seller,5,137,I will do 1 month SEO for your website or blog,€,93.16,seo,8552,2019-03-29T16:34:32Z
102665523,virtualsuperman,Level 2 Seller,5,221,I will embed your google map in web2 sites for local SEO,€,4.66,seo,8552,2019-03-29T16:34:32Z
4563766,shokatalam,Level 1 Seller,4.9,269,I will do deep on page SEO of your website,€,27.95,seo,8552,2019-03-29T16:34:32Z
47092594,seodude73,Level 2 Seller,4.9,120,I will improve your SEO by building 297 quality backlinks,€,46.58,seo,8552,2019-03-29T16:34:32Z
103117729,heavisidegroup,NA,4.9,27,I will provide pro SEO backlinks with white hat guest posts,€,93.16,seo,8552,2019-03-29T16:34:32Z
125158999,brady_bear,Level 2 Seller,5,2,I will give uprank armor complete SEO package for your website top ranking,€,65.21,seo,8552,2019-03-29T16:34:32Z
106690891,marleen_seo,NA,5,62,I will do full on site SEO for wordpress or shopify,€,46.58,seo,8552,2019-03-29T16:34:32Z
98003380,brady_bear,Level 2 Seller,4.9,140,"I will create high quality backlinks, monthly SEO service",€,32.61,seo,8552,2019-03-29T16:34:32Z
108580341,ng_1stin,NA,5,3,I will be your SEO agency,€,391,seo,8552,2019-03-29T16:34:32Z
125696370,markduncan338,NA,NA,NA,I will 150 google citations to improve local SEO,€,93.16,seo,8552,2019-03-29T16:34:32Z
123994566,denniskr,NA,4,4,I will search engine optimize your site and deliver more,€,37.27,seo,8552,2019-03-29T16:34:32Z
125038252,fienep,NA,5,2,I will check your website for critical SEO mistakes,€,9.32,seo,8552,2019-03-29T16:34:32Z
123665950,meghans1,NA,4.7,1,I will do onsite SEO markup for search engines,€,13.97,seo,8552,2019-03-29T16:34:32Z
7272462,mattservey,Level 2 Seller,5,278,I will setup onsite SEO for your wix website,€,9.32,seo,8552,2019-03-29T16:34:32Z
122655776,georgepritchard,NA,5,1,I will create a clear and epic SEO strategy report,€,559,seo,8552,2019-03-29T16:34:32Z
124308522,net_links,NA,5,10,I will boost your google ranking with high authority seo backlinks,€,4.66,seo,8552,2019-03-29T16:34:32Z
3754429,webseowizard,Level 2 Seller,5,41,I will do onsite SEO for your website or blog,€,18.63,seo,8552,2019-03-29T16:34:32Z
116558615,seonex,Level 2 Seller,5,37,I will build 100 unique domain SEO backlinks on da100 tf100 sites,€,23.29,seo,8552,2019-03-29T16:34:32Z
110141130,heavisidegroup,NA,4,4,I will fix your on site SEO,€,186,seo,8552,2019-03-29T16:34:32Z
110789362,bravedigital,Level 2 Seller,4.9,68,I will do the ultimate SEO campaign for google first page ranking,€,46.58,seo,8552,2019-03-29T16:34:32Z
39847635,zuhairhussain,Top Rated Seller,4.9,380,I will do complete SEO optimization for top google ranking,€,69.87,seo,8552,2019-03-29T16:34:32Z
125272327,one_rank,NA,5,41,I will boost your google ranking with seo backlinks,€,4.66,seo,8552,2019-03-29T16:34:32Z
46996614,lisa_rank,Level 2 Seller,5,497,"I will elevate your ranking, monthly SEO services",€,37.27,seo,8552,2019-03-29T16:34:32Z
121001858,jayashree555,Level 2 Seller,5,3,I will do weekly 14 days monthly SEO backlink building,€,23.29,seo,8552,2019-03-29T16:34:32Z
109819674,localinteractiv,NA,5,44,I will provide SEO plan for your site to rank first,€,140,seo,8552,2019-03-29T16:34:32Z
59438,markp,Top Rated Seller,5,1000,I will create a SEO audit report and action plan and implement it,€,13.97,seo,8552,2019-03-29T16:34:32Z
123493791,alex_rumer,Level 2 Seller,4.9,159,I will help you rank higher on google with safe high da SEO contextual backlinks,€,4.66,seo,8552,2019-03-29T16:34:32Z
1240615,ozzieuk,Top Rated Seller,5,1000,I will catapult your rankings with my high pr seo authority links,€,18.63,seo,8552,2019-03-29T16:34:32Z
40139815,ankitaphp,Level 2 Seller,5,12,I will improve the ranking of your magento website with SEO,€,65.21,seo,8552,2019-03-29T16:34:32Z
114986610,marleen_seo,NA,4.9,11,"I will do on page SEO for squarespace, wix, joomla or weebly site",€,46.58,seo,8552,2019-03-29T16:34:32Z
119136775,aw_services,Level 2 Seller,5,9,I will be your french SEO agency during 4 weeks,€,182,seo,8552,2019-03-29T16:34:32Z
104510035,tuhin2u,Level 2 Seller,4.9,158,I will do monthly SEO service to create high da whitehat backlinks,€,51.24,seo,8552,2019-03-29T16:34:32Z
107320393,serplab,Level 2 Seller,5,302,"I will build high authority backlinks from top news sites via 301 redirect, high da SEO",€,23.29,seo,8552,2019-03-29T16:34:32Z
47429234,nancy4u,Level 2 Seller,5,296,I will create 50 SEO authority backlinks with da 60 to 90,€,4.66,seo,8552,2019-03-29T16:34:32Z
67036611,ana_seo_85,Level 2 Seller,5,130,I will build perfect seo strategy backlinks,€,512,seo,8552,2019-03-29T16:34:32Z
17885759,niche_backlink,Level 2 Seller,4.9,237,I will rank you first using 2019 best SEO service,€,41.92,seo,8552,2019-03-29T16:34:32Z
78119501,ifajig,Level 1 Seller,4.9,387,I will post safe seo high trust flow tumblr pbn back links rank any site any keyword,€,93.16,seo,8552,2019-03-29T16:34:32Z
